{
  "$schema": "https://json-schema.org/draft/2020-12/schema",
  "$id": "https://project-skills.dev/schemas/agent-blueprint/3.0.0",
  "title": "Governed Agent Blueprint",
  "type": "object",
  "additionalProperties": false,
  "required": ["schemaVersion", "id", "name"],
  "properties": {
    "schemaVersion": { "enum": ["1.0.0", "2.0.0", "2.1.0", "2.2.0", "2.3.0", "3.0.0"] },
    "agentType": { "enum": ["copilot", "foundry-prompt", "foundry-hosted", "portable", "copilot-studio"] },
    "nativeSpec": { "$ref": "copilot-studio-handoff.schema.json#/$defs/reference" },
    "guide": {
      "allOf": [
        { "$ref": "copilot-studio-handoff.schema.json#/$defs/reference" },
        { "properties": { "path": { "const": ".github/instructions/copilot-studio.instructions.md" } } }
      ]
    },
    "id": { "type": "string", "pattern": "^[a-z][a-z0-9]*(?:-[a-z0-9]+)*$", "maxLength": 64 },
    "name": { "type": "string", "minLength": 3, "maxLength": 80 },
    "description": { "type": "string", "minLength": 40, "maxLength": 500 },
    "purpose": { "type": "string", "minLength": 20, "maxLength": 1000 },
    "risk": { "enum": ["read-only", "mutating"] },
    "capabilities": {
      "type": "array",
      "minItems": 1,
      "uniqueItems": true,
      "items": { "enum": ["read", "search", "web", "edit", "execute", "agent", "todo"] }
    },
    "autonomy": {
      "type": "object",
      "additionalProperties": false,
      "required": ["mode", "approvalRequiredFor", "webSafety"],
      "properties": {
        "mode": { "enum": ["guided", "autonomous-research"] },
        "approvalRequiredFor": {
          "type": "array",
          "minItems": 6,
          "uniqueItems": true,
          "items": {
            "enum": [
              "purchase-or-payment",
              "booking-or-external-commitment",
              "provider-contact-or-message",
              "account-identity-or-security-change",
              "sensitive-data-disclosure",
              "destructive-or-irreversible-action"
            ]
          }
        },
        "webSafety": { "enum": ["standard", "threat-informed"] }
      },
      "allOf": [
        { "properties": { "approvalRequiredFor": { "contains": { "const": "purchase-or-payment" } } } },
        { "properties": { "approvalRequiredFor": { "contains": { "const": "booking-or-external-commitment" } } } },
        { "properties": { "approvalRequiredFor": { "contains": { "const": "provider-contact-or-message" } } } },
        { "properties": { "approvalRequiredFor": { "contains": { "const": "account-identity-or-security-change" } } } },
        { "properties": { "approvalRequiredFor": { "contains": { "const": "sensitive-data-disclosure" } } } },
        { "properties": { "approvalRequiredFor": { "contains": { "const": "destructive-or-irreversible-action" } } } }
      ]
    },
    "invocation": {
      "type": "object",
      "additionalProperties": false,
      "required": ["userInvocable", "modelInvocable"],
      "properties": {
        "userInvocable": { "type": "boolean" },
        "modelInvocable": { "type": "boolean" }
      }
    },
    "instructions": {
      "type": "object",
      "additionalProperties": false,
      "required": ["constraints", "approach", "outputFormat"],
      "properties": {
        "constraints": { "type": "array", "minItems": 1, "uniqueItems": true, "items": { "type": "string", "minLength": 10, "maxLength": 500 } },
        "approach": { "type": "array", "minItems": 2, "maxItems": 12, "items": { "type": "string", "minLength": 10, "maxLength": 500 } },
        "outputFormat": { "type": "string", "minLength": 10, "maxLength": 1000 }
      }
    },
    "subagents": {
      "type": "array",
      "uniqueItems": true,
      "items": { "type": "string", "pattern": "^[a-z][a-z0-9]*(?:-[a-z0-9]+)*$", "maxLength": 64 }
    },
    "handoffs": {
      "type": "array",
      "maxItems": 8,
      "items": {
        "type": "object",
        "additionalProperties": false,
        "required": ["label", "agent", "prompt", "send"],
        "properties": {
          "label": { "type": "string", "minLength": 3, "maxLength": 80 },
          "agent": { "type": "string", "pattern": "^[a-z][a-z0-9]*(?:-[a-z0-9]+)*$", "maxLength": 64 },
          "prompt": { "type": "string", "minLength": 10, "maxLength": 1000 },
          "send": { "const": false }
        }
      }
    },
    "azure": {
      "type": "object",
      "additionalProperties": false,
      "required": ["required", "cloud", "location", "environmentName", "authenticationMethod", "subscriptionConfigured"],
      "properties": {
        "required": { "type": "boolean" },
        "cloud": { "enum": ["AzureCloud", "AzureUSGovernment"] },
        "location": { "type": "string", "pattern": "^[a-z0-9-]+$", "maxLength": 64 },
        "environmentName": { "type": "string", "pattern": "^[a-zA-Z0-9][a-zA-Z0-9-]{0,39}$" },
        "authenticationMethod": { "enum": ["interactive", "managed-identity"] },
        "subscriptionConfigured": { "type": "boolean" }
      }
    },
    "distribution": { "$ref": "#/$defs/distribution" },
    "publication": {
      "type": "object",
      "additionalProperties": false,
      "required": ["targets", "versionPolicy"],
      "properties": {
        "targets": {
          "type": "array",
          "minItems": 1,
          "maxItems": 3,
          "uniqueItems": true,
          "items": { "enum": ["foundry-endpoint", "microsoft-365-copilot-and-teams", "chatgpt-action"] }
        },
        "versionPolicy": { "enum": ["latest", "pinned"] },
        "microsoft365Audience": { "enum": ["individual", "tenant"] },
        "chatgptVisibility": { "enum": ["workspace", "link", "gpt-store"] }
      },
      "allOf": [
        {
          "if": {
            "properties": { "targets": { "contains": { "const": "microsoft-365-copilot-and-teams" } } },
            "required": ["targets"]
          },
          "then": { "required": ["microsoft365Audience"] },
          "else": { "not": { "required": ["microsoft365Audience"] } }
        },
        {
          "if": {
            "properties": { "targets": { "contains": { "const": "chatgpt-action" } } },
            "required": ["targets"]
          },
          "then": { "required": ["chatgptVisibility"] },
          "else": { "not": { "required": ["chatgptVisibility"] } }
        }
      ]
    }
  },
  "allOf": [
    {
      "if": { "properties": { "schemaVersion": { "const": "3.0.0" } }, "required": ["schemaVersion"] },
      "then": {
        "required": ["agentType", "nativeSpec", "guide"],
        "properties": {
          "agentType": { "const": "copilot-studio" },
          "name": { "pattern": "^[^\\s@/\\-][^\\r\\n\\t]*$" }
        },
        "not": {
          "anyOf": [
            { "required": ["description"] }, { "required": ["purpose"] }, { "required": ["risk"] },
            { "required": ["capabilities"] }, { "required": ["autonomy"] }, { "required": ["invocation"] },
            { "required": ["instructions"] }, { "required": ["subagents"] }, { "required": ["handoffs"] },
            { "required": ["azure"] }, { "required": ["publication"] }, { "required": ["distribution"] }
          ]
        }
      },
      "else": {
        "required": ["description", "purpose", "risk", "capabilities", "invocation", "instructions", "subagents", "handoffs"],
        "properties": { "agentType": { "enum": ["copilot", "foundry-prompt", "foundry-hosted", "portable"] } },
        "not": { "anyOf": [{ "required": ["nativeSpec"] }, { "required": ["guide"] }] }
      }
    },
    {
      "if": { "properties": { "schemaVersion": { "enum": ["2.0.0", "2.1.0", "2.2.0", "2.3.0"] } }, "required": ["schemaVersion"] },
      "then": { "required": ["agentType"] }
    },
    {
      "if": { "properties": { "schemaVersion": { "enum": ["2.1.0", "2.2.0", "2.3.0"] } }, "required": ["schemaVersion"] },
      "then": { "required": ["autonomy"] }
    },
    {
      "if": { "required": ["autonomy"] },
      "then": { "properties": { "schemaVersion": { "enum": ["2.1.0", "2.2.0", "2.3.0"] } } }
    },
    {
      "if": {
        "properties": { "autonomy": { "properties": { "mode": { "const": "autonomous-research" } }, "required": ["mode"] } },
        "required": ["autonomy"]
      },
      "then": {
        "properties": {
          "risk": { "const": "read-only" },
          "capabilities": { "items": { "enum": ["read", "search", "web"] } }
        }
      }
    },
    {
      "if": {
        "properties": { "autonomy": { "properties": { "webSafety": { "const": "threat-informed" } }, "required": ["webSafety"] } },
        "required": ["autonomy"]
      },
      "then": { "properties": { "capabilities": { "contains": { "const": "web" } } } }
    },
    {
      "if": { "properties": { "agentType": { "enum": ["foundry-prompt", "foundry-hosted"] } }, "required": ["agentType"] },
      "then": {
        "required": ["azure"],
        "properties": { "azure": { "properties": { "required": { "const": true } } } }
      }
    },
    {
      "if": { "properties": { "agentType": { "const": "portable" } }, "required": ["agentType"] },
      "then": { "properties": { "schemaVersion": { "const": "2.3.0" } } }
    },
    {
      "if": { "required": ["distribution"] },
      "then": {
        "properties": { "schemaVersion": { "const": "2.3.0" } },
        "not": { "required": ["publication"] }
      }
    },
    {
      "if": { "required": ["publication"] },
      "then": {
        "required": ["agentType", "azure"],
        "properties": {
          "schemaVersion": { "const": "2.2.0" },
          "agentType": { "enum": ["foundry-prompt", "foundry-hosted"] },
          "azure": { "properties": { "required": { "const": true } } }
        }
      }
    }
  ],
  "$defs": {
    "distribution": {
      "type": "object",
      "additionalProperties": false,
      "required": ["targets", "versionPolicy"],
      "properties": {
        "targets": {
          "type": "array",
          "minItems": 1,
          "maxItems": 6,
          "uniqueItems": true,
          "items": {
            "enum": [
              "foundry-endpoint", "microsoft-365-copilot-and-teams", "microsoft-365-agents-toolkit",
              "copilot-studio", "openai-api-application", "chatgpt-action-handoff"
            ]
          }
        },
        "versionPolicy": { "enum": ["latest", "pinned"] },
        "environment": { "enum": ["development", "staging", "production"] },
        "dataBoundary": { "enum": ["project-local", "organization", "external"] },
        "microsoft365Audience": { "enum": ["individual", "tenant"] },
        "chatgptVisibility": { "enum": ["workspace", "link", "gpt-store"] }
      },
      "allOf": [
        {
          "if": {
            "properties": {
              "targets": { "contains": { "enum": ["microsoft-365-copilot-and-teams", "microsoft-365-agents-toolkit"] } }
            },
            "required": ["targets"]
          },
          "then": { "required": ["microsoft365Audience"] },
          "else": { "not": { "required": ["microsoft365Audience"] } }
        },
        {
          "if": {
            "properties": { "targets": { "contains": { "const": "chatgpt-action-handoff" } } },
            "required": ["targets"]
          },
          "then": { "required": ["chatgptVisibility"] },
          "else": { "not": { "required": ["chatgptVisibility"] } }
        }
      ]
    }
  }
}